{"$schema":"https://json-schema.org/draft/2020-12/schema","title":"Govee livery scheme","type":"object",
"required":["slug","name","contrail","primary","steps"],
"$defs":{"rgb":{"type":"object","required":["r","g","b"],"properties":{"r":{"type":"integer","minimum":0,"maximum":255},"g":{"type":"integer","minimum":0,"maximum":255},"b":{"type":"integer","minimum":0,"maximum":255}}},
"brightness":{"type":"integer","minimum":1,"maximum":100}},
"properties":{"slug":{"type":"string"},"name":{"type":"string"},"registration":{"type":["string","null"]},"group":{"type":"string"},"source":{"type":"string"},
"contrail":{"type":"array","items":{"type":"string","pattern":"^#[0-9a-f]{6}$"}},
"primary":{"type":"object","required":["color","brightness"],"properties":{"color":{"$ref":"#/$defs/rgb"},"source_hex":{"type":"string"},"brightness":{"$ref":"#/$defs/brightness"}}},
"loop":{"type":"boolean"},
"steps":{"type":"array","minItems":1,"items":{"type":"object","required":["color","brightness","holdMs"],"properties":{
 "color":{"$ref":"#/$defs/rgb"},"source_hex":{"type":"string"},"brightness":{"$ref":"#/$defs/brightness"},"holdMs":{"type":"integer","minimum":0},
 "pulse":{"type":"object","required":["type","toBrightness","periodMs","count"],"properties":{"type":{"const":"breathe"},"toBrightness":{"$ref":"#/$defs/brightness"},"periodMs":{"type":"integer"},"count":{"type":"integer"}}},
 "strobe":{"type":"object","required":["count","onMs","offMs"],"properties":{"count":{"type":"integer"},"onMs":{"type":"integer","minimum":250},"offMs":{"type":"integer","minimum":250}}}}}}}}
