{
  "slug": "florida-one",
  "name": "Florida One",
  "registration": "N945WN",
  "group": "state",
  "source": "mark-winters/jaysplanes web/src/game/core/liveries.ts",
  "contrail": [
    "#c22b3a",
    "#ffffff"
  ],
  "primary": {
    "color": {
      "r": 194,
      "g": 43,
      "b": 58
    },
    "hex": "#c22b3a",
    "brightness": 100
  },
  "loop": true,
  "steps": [
    {
      "color": {
        "r": 194,
        "g": 43,
        "b": 58
      },
      "hex": "#c22b3a",
      "brightness": 100,
      "holdMs": 2500
    },
    {
      "color": {
        "r": 255,
        "g": 255,
        "b": 255
      },
      "hex": "#ffffff",
      "brightness": 70,
      "holdMs": 2500
    },
    {
      "color": {
        "r": 194,
        "g": 43,
        "b": 58
      },
      "hex": "#c22b3a",
      "brightness": 40,
      "holdMs": 1500,
      "pulse": {
        "type": "breathe",
        "toBrightness": 100,
        "periodMs": 3000,
        "count": 2
      }
    }
  ]
}