{
  "slug": "lone-star-one",
  "name": "Lone Star One",
  "registration": "N8660A",
  "group": "state",
  "source": "mark-winters/jaysplanes web/src/game/core/liveries.ts",
  "contrail": [
    "#1b3d8f",
    "#c22b3a"
  ],
  "primary": {
    "color": {
      "r": 27,
      "g": 61,
      "b": 143
    },
    "hex": "#1b3d8f",
    "brightness": 100
  },
  "loop": true,
  "steps": [
    {
      "color": {
        "r": 27,
        "g": 61,
        "b": 143
      },
      "hex": "#1b3d8f",
      "brightness": 100,
      "holdMs": 2500
    },
    {
      "color": {
        "r": 194,
        "g": 43,
        "b": 58
      },
      "hex": "#c22b3a",
      "brightness": 100,
      "holdMs": 2500
    },
    {
      "color": {
        "r": 27,
        "g": 61,
        "b": 143
      },
      "hex": "#1b3d8f",
      "brightness": 40,
      "holdMs": 1500,
      "pulse": {
        "type": "breathe",
        "toBrightness": 100,
        "periodMs": 3000,
        "count": 2
      }
    }
  ]
}